{
  "schema_version": "pdx_tool_request_v1",
  "tool": "prodocux.render_artifact",
  "request_id": "g1a-pdx-render-docx",
  "inputs": {
    "kernel_request": {
      "schema_version": "prodocux_render_request_v1",
      "request_id": "g1a-render-docx-artifact",
      "target_format": "docx",
      "content": {
        "schema_version": "prodocux_content_blocks_v1",
        "blocks": [
          {
            "id": "title",
            "type": "heading",
            "level": 1,
            "text": "Synthetic document"
          }
        ]
      },
      "output": {
        "output_name": "summary.docx",
        "delivery_mode": "artifact"
      }
    }
  }
}
